{
  "id": "ai-news-2026-09-21",
  "guid": "4ccbb774-2559-53c3-b744-af78d80a39f7",
  "externalId": "ai-news-2026-09-21",
  "title": "Daily AI Newsletter — September 21, 2026",
  "summary": "Press skepticism grew over Anthropic's own safety pledges, the US and China agreed to an AI dialogue ahead of their leaders' summit, and a Microsoft exec called AI training mass labor theft.",
  "publishDate": "2026-09-21T09:04:49-05:00",
  "status": "published",
  "audio": {
    "file": "audio.mp3",
    "bytes": 7444189,
    "durationSeconds": 437.786122,
    "mimeType": "audio/mpeg"
  },
  "ingestedAt": "2026-09-21T14:11:21.361Z",
  "updatedAt": "2026-09-21T14:11:21.361Z"
}
