{
  "id": "2026-07-19",
  "guid": "5102fe12-e168-5414-adf3-9b11ee648d44",
  "externalId": "2026-07-19",
  "title": "AI News Daily — July 19, 2026",
  "summary": "The AI trade hit its roughest patch of the year: chip stocks logged their worst week since March 2025 on fears that Moonshot's cheap, powerful Kimi K3 is a 'DeepSeek moment' for US infrastructure spending, and Apple used the dip to reclaim the title of world's most valuable company from NVIDIA. Two frontier-lab safety leaders are on their way out, while Microsoft and 1Password both shipped new AI security and agent-access tools.",
  "publishDate": "2026-07-19T09:07:05-05:00",
  "status": "published",
  "audio": {
    "file": "audio.mp3",
    "bytes": 5901898,
    "durationSeconds": 341.394286,
    "mimeType": "audio/mpeg"
  },
  "ingestedAt": "2026-07-19T20:42:08.216Z",
  "updatedAt": "2026-07-19T22:39:59.448Z"
}
