{
  "id": "ai-news-2026-09-14",
  "guid": "8c50a8ea-b3b9-5159-b131-b2b91457eefc",
  "externalId": "ai-news-2026-09-14",
  "title": "Daily AI Newsletter — September 14, 2026",
  "summary": "AI labs rallied behind a call to slow development and revealed their own oversight talks, Anthropic prepared a record stock listing, and a math institute said a disputed AI-claimed proof appears solved.",
  "publishDate": "2026-09-14T09:07:23-05:00",
  "status": "published",
  "audio": {
    "file": "audio.mp3",
    "bytes": 10366560,
    "durationSeconds": 620.434286,
    "mimeType": "audio/mpeg"
  },
  "ingestedAt": "2026-09-14T14:16:20.560Z",
  "updatedAt": "2026-09-14T14:16:20.560Z"
}
