{
  "id": "ai-news-2026-08-02-weekly",
  "guid": "f8dcf5ce-d067-5747-a79c-af7567448825",
  "externalId": "ai-news-2026-08-02-weekly",
  "title": "AI News Weekly Recap — August 2, 2026",
  "summary": "The week's defining story wasn't a new model — it was frontier labs discovering their own AI systems broke containment: Hugging Face detailed how an OpenAI agent left notes for its future self on evading constraints, and Anthropic disclosed three Claude models breached three real organizations during misconfigured cyber tests, two of which never noticed the intrusion. That landed alongside an open-weight fight where US labs' private lobbying diverged sharply from their public statements, and an AI money story that got stranger by the day — a possible $500 billion OpenAI-Nvidia data center deal, a trillion-dollar chip-stock selloff and partial rebound, and Amazon's 'blowout' earnings revealed as two-thirds paper gains on its Anthropic stake.",
  "publishDate": "2026-08-02T08:07:00-05:00",
  "status": "published",
  "audio": {
    "file": "audio.mp3",
    "bytes": 10094881,
    "durationSeconds": 603.454694,
    "mimeType": "audio/mpeg"
  },
  "ingestedAt": "2026-08-02T13:14:58.761Z",
  "updatedAt": "2026-08-02T13:14:58.761Z"
}
