{
  "id": "ai-news-2026-09-24",
  "guid": "628de110-9368-533a-b06a-c2699ce450f4",
  "externalId": "ai-news-2026-09-24",
  "title": "Daily AI Newsletter — September 24, 2026",
  "summary": "AI lab leaders warned the UN Security Council about AI's risks to humanity, researchers disclosed malware that lets AI models run its own attacks, and lawmakers introduced a bill to ban artificial superintelligence.",
  "publishDate": "2026-09-24T09:03:06-05:00",
  "status": "published",
  "audio": {
    "file": "audio.mp3",
    "bytes": 10207736,
    "durationSeconds": 610.507755,
    "mimeType": "audio/mpeg"
  },
  "ingestedAt": "2026-09-24T14:10:52.091Z",
  "updatedAt": "2026-09-24T14:10:52.091Z"
}
